experiment_id,display_name,current_status,allowed_to_select_officially,total_days_observed,pick_days,no_bet_days,picks_total,settled_picks,wins,losses,hit_rate,profit_units,roi_percent,brier_score,max_drawdown,average_calibrated_probability,market_mix,failure_mode_mix,comparison_vs_official,promotion_recommendation,promotion_reason,required_next_evidence
OFFICIAL_BASELINE,vSIGMA Competition Accuracy Mode + Probability Calibration,OFFICIAL,True,10,10,0,18,8,5,3,62.5,-0.66,-8.25,0.282192,-0.65,0.80331,OVER_1_5:14; OVER_2_5:3; UNDER_3_5:1,FAILURE_MODE_LOW_CONVERSION:34; market_fit=SAFE_OK:18; LOW_CONVERSION:17; market=OVER_1_5:14; market=OVER_2_5:3; edge=0.202:2; FAILURE_MODE_AVALANCHE_RISK:2; edge=0.136:1; edge=0.141:1; edge=0.240:1; edge=0.123:1; edge=0.188:1; edge=0.167:1; edge=0.126:1; edge=0.259:1; edge=0.160:1; edge=0.170:1; edge=0.182:1; edge=0.249:1; market=UNDER_3_5:1; edge=0.116:1; AVALANCHE_RISK:1; edge=0.191:1; edge=0.220:1; edge=0.131:1,official reference,KEEP_OFFICIAL_BASELINE,Official baseline remains frozen; governance does not alter selection logic.,Continue accumulating official settled outcomes and compare challengers against it.
CANDIDATE_V2_SCHEDULE_ANOMALY,Candidate v2 Schedule Strength + Anomaly Cleaning,SHADOW,False,15,14,1,24,7,4,3,57.142857,-1.18,-16.857143,0.308389,-1.1,0.803799,OVER_1_5:21; OVER_2_5:3,FAILURE_MODE_LOW_CONVERSION:32; market_fit=SAFE_OK:16; LOW_CONVERSION:16; market=OVER_1_5:14; market=OVER_2_5:2; edge=0.135:1; edge=0.136:1; edge=0.201:1; edge=0.222:1; edge=0.199:1; edge=0.190:1; edge=0.169:1; edge=0.126:1; edge=0.246:1; edge=0.154:1; edge=0.173:1; edge=0.185:1; edge=0.235:1; edge=0.196:1; edge=0.219:1; edge=0.134:1,hit:worse; roi:worse; profit:worse; brier:worse; drawdown:worse,SAMPLE_TOO_SMALL,Only 7 settled picks; candidate cannot be promoted before 30 settled picks.,Continue shadow tracking with immutable ledger outcomes.
CANDIDATE_V3_ODDS_DEPTH,Candidate v3 Odds Structure Depth,NOT_PROMOTED,False,16,0,16,0,0,0,0,,0.0,,,0.0,,,,hit:insufficient; roi:insufficient; profit:better; brier:insufficient; drawdown:better,AUDIT_ONLY,"Registry marks this experiment as audit-only, so it is not promotion eligible.",Keep as an audit comparator unless registry governance explicitly changes its role.
CANDIDATE_V4_O25_FIREWALL,Candidate v4 O2.5 Low Conversion Firewall,SHADOW,False,15,14,1,23,7,5,2,71.428571,0.07,1.0,0.218245,-0.45,0.80308,OVER_1_5:23,FAILURE_MODE_LOW_CONVERSION:30; market_fit=SAFE_OK:15; LOW_CONVERSION:15; market=OVER_1_5:14; edge=0.135:1; edge=0.136:1; edge=0.201:1; edge=0.222:1; edge=0.199:1; edge=0.190:1; edge=0.169:1; edge=0.126:1; edge=0.154:1; edge=0.173:1; edge=0.185:1; market=OVER_2_5:1; edge=0.235:1; edge=0.196:1; edge=0.219:1; edge=0.134:1,hit:better; roi:better; profit:better; brier:better; drawdown:better,SAMPLE_TOO_SMALL,Only 7 settled picks; candidate cannot be promoted before 30 settled picks.,Continue shadow tracking with immutable ledger outcomes.
CANDIDATE_V5_PLAYER_IMPACT,Candidate v5 Player Impact Layer,SHADOW,False,15,14,1,24,7,5,2,71.428571,0.07,1.0,0.221381,-0.45,0.803362,OVER_1_5:22; OVER_2_5:2,FAILURE_MODE_LOW_CONVERSION:32; market_fit=SAFE_OK:16; LOW_CONVERSION:16; market=OVER_1_5:14; market=OVER_2_5:2; edge=0.135:1; edge=0.136:1; edge=0.201:1; edge=0.222:1; edge=0.199:1; edge=0.190:1; edge=0.169:1; edge=0.126:1; edge=0.246:1; edge=0.154:1; edge=0.173:1; edge=0.185:1; edge=0.235:1; edge=0.196:1; edge=0.219:1; edge=0.134:1,hit:better; roi:better; profit:better; brier:better; drawdown:better,SAMPLE_TOO_SMALL,Only 7 settled picks; candidate cannot be promoted before 30 settled picks.,Continue shadow tracking with immutable ledger outcomes.
CANDIDATE_V6_API_PREDICTIONS,Candidate v6 API Predictions Benchmark,AUDIT_ONLY,False,15,14,1,22,6,4,2,66.666667,-0.18,-3.0,0.251104,-0.45,0.803951,OVER_1_5:21; OVER_2_5:1,FAILURE_MODE_LOW_CONVERSION:30; market_fit=SAFE_OK:15; LOW_CONVERSION:15; market=OVER_1_5:14; edge=0.135:1; edge=0.136:1; edge=0.201:1; edge=0.222:1; edge=0.199:1; edge=0.190:1; edge=0.169:1; edge=0.126:1; market=OVER_2_5:1; edge=0.246:1; edge=0.154:1; edge=0.173:1; edge=0.185:1; edge=0.196:1; edge=0.219:1; edge=0.134:1,hit:better; roi:better; profit:better; brier:better; drawdown:better,AUDIT_ONLY,"Registry marks this experiment as audit-only, so it is not promotion eligible.",Keep as an audit comparator unless registry governance explicitly changes its role.
CANDIDATE_V7_PRICE_DISCIPLINE,Candidate v7 Price Discipline + CLV + Drift Execution Guard,SHADOW,False,11,9,3,12,1,0,1,0.0,-1.0,-100.0,0.652097,0.0,0.801914,OVER_1_5:9; OVER_2_5:3,FAILURE_MODE_LOW_CONVERSION:22; market_fit=SAFE_OK:11; LOW_CONVERSION:11; market=OVER_1_5:9; market=OVER_2_5:2; edge=0.201:1; edge=0.222:1; edge=0.190:1; edge=0.169:1; edge=0.246:1; edge=0.154:1; edge=0.173:1; edge=0.235:1; edge=0.196:1; edge=0.219:1; edge=0.134:1,hit:worse; roi:worse; profit:worse; brier:worse; drawdown:better,SAMPLE_TOO_SMALL,Only 1 settled picks; candidate cannot be promoted before 30 settled picks.,Continue shadow tracking with immutable ledger outcomes.
