target_date,priority,category,title,reason,expected_impact,risk,recommended_action,apply_now,evidence
2026-05-30,P1,execution,Improve prelock timing schedule,Decision outcome ledger includes expired or prelock unavailable decisions.,Reduces non-actionable PRELOCK outcomes caused by late or missing execution windows.,Low if limited to scheduling and reporting diagnostics.,Review AUTO/PRELOCK timing so resolver runs before kickoff and captures a useful in-window slot.,YES,prelock_not_available=0; expired=2
2026-05-30,P1,execution,Keep actionable and non-actionable buckets separated,The current day has waiting or blocked decisions.,Keeps ledger/backtest interpretation aligned with execution reality.,Low; reporting-only validation.,"Continue reporting all rows, actionable only, non-actionable, and graded bets separately.",YES,blocked=2; waiting=1; auto_status=EXECUTABLE
2026-05-30,P2,api_data,Target API enrichment to candidate fixtures only,"Coverage gaps are present, but broad calendar enrichment would add cost and repo churn.",Improves prelock evidence where it matters without expanding data volume unnecessarily.,Medium; API quotas and cache growth must be controlled.,"Fetch lineups only for candidate picks in-window, injuries only for reliable leagues, and fixture statistics only for TOP candidates; keep cache bounds.",YES,prelock_lineup_state=LINEUPS_NOT_AVAILABLE: 1; prelock_odds_state=ODDS_NOT_AVAILABLE: 1
2026-05-30,P3,decision_quality,Collect more closed decision quality outcomes,Decision Quality Review has fewer than 30 resolved rows.,Avoids premature recalibration or execution-rule changes from a thin sample.,Low; reporting only.,Keep building the quality review after POST labels are available.,NO,resolved_quality_rows=0
2026-05-30,P3,model_calibration,Defer recalibration until minimum closed-pick sample,Fewer than 30 closed picks are available.,Avoids fitting thresholds or probability adjustments to noise.,Low; no predictive change is applied.,Keep calibration reporting active and wait for at least 30 closed picks before suggestions.,NO,closed_picks=8; enough_sample=NO; recalibration_allowed=NO
